{
  "framework_version": "0.1.0",
  "source": {
    "provider": "nvidia-skillevaluator",
    "evaluator_version": "0.2.1",
    "report_type": "tier3"
  },
  "skill": {
    "id": "pm.performance.attribution",
    "name": "Performance Attribution",
    "version": "0.1.0"
  },
  "benchmark_context": {
    "agent": "claude-code",
    "model": "claude-sonnet-5",
    "dataset": "sha256:11fd0cb90a7ea90f476866934f7a9fbd77657b5fc30fb5d8426e7ab48e3dffa3",
    "evaluator_version": "0.2.1",
    "environment": {
      "value": "docker",
      "source": "CLI"
    },
    "fingerprint": "313b651235a10ab182a91263bb4a08a834934ec101621f827a47089fb3d5ba32"
  },
  "generic_metrics": {
    "security": 1.0,
    "correctness": 0.992,
    "discoverability": 0.8862,
    "effectiveness": 0.9342,
    "efficiency": 0.8704
  },
  "skill_lift": {
    "with_skill": 0.9362,
    "without_skill": 0.8109,
    "delta": 0.1253
  },
  "reliability": {
    "with_skill": {
      "k": 3,
      "pass_threshold": 0.8,
      "stop_on_pass": false,
      "passed_cases": 23,
      "failed_cases": 2,
      "total_cases": 25,
      "rate": 0.92,
      "rate_interval": {
        "method": "wilson_score",
        "confidence_level": 0.95,
        "lower": 0.7503389104960468,
        "upper": 0.9777795987151524
      },
      "attempts_used": 75,
      "max_attempts_possible": 75,
      "avg_attempts_used": 3.0,
      "extra_cases": [],
      "cases": {
        "performance--001": {
          "passed": true,
          "first_pass_attempt": 1,
          "attempts_used": 3,
          "attempts_skipped": 0,
          "attempts_missing": 0,
          "best_score": 0.9604,
          "attempts": [
            {
              "attempt": 1,
              "trial": "performance--001__62dRysR",
              "score": 0.822,
              "passed": true
            },
            {
              "attempt": 2,
              "trial": "performance--001__nByKHts",
              "score": 0.9604,
              "passed": true
            },
            {
              "attempt": 3,
              "trial": "performance--001__mjsbyV6",
              "score": 0.8428,
              "passed": true
            }
          ]
        },
        "performance--002": {
          "passed": true,
          "first_pass_attempt": 1,
          "attempts_used": 3,
          "attempts_skipped": 0,
          "attempts_missing": 0,
          "best_score": 0.8688,
          "attempts": [
            {
              "attempt": 1,
              "trial": "performance--002__5YC7ZaW",
              "score": 0.8688,
              "passed": true
            },
            {
              "attempt": 2,
              "trial": "performance--002__CyVBAgw",
              "score": 0.8595,
              "passed": true
            },
            {
              "attempt": 3,
              "trial": "performance--002__fFebpAZ",
              "score": 0.8417,
              "passed": true
            }
          ]
        },
        "performance--003": {
          "passed": true,
          "first_pass_attempt": 1,
          "attempts_used": 3,
          "attempts_skipped": 0,
          "attempts_missing": 0,
          "best_score": 0.9896,
          "attempts": [
            {
              "attempt": 1,
              "trial": "performance--003__czik7bg",
              "score": 0.8563,
              "passed": true
            },
            {
              "attempt": 2,
              "trial": "performance--003__y9kJn8C",
              "score": 0.9813,
              "passed": true
            },
            {
              "attempt": 3,
              "trial": "performance--003__9ukkxhY",
              "score": 0.9896,
              "passed": true
            }
          ]
        },
        "performance--004": {
          "passed": true,
          "first_pass_attempt": 1,
          "attempts_used": 3,
          "attempts_skipped": 0,
          "attempts_missing": 0,
          "best_score": 1.0,
          "attempts": [
            {
              "attempt": 1,
              "trial": "performance--004__AkoHfJx",
              "score": 1.0,
              "passed": true
            },
            {
              "attempt": 2,
              "trial": "performance--004__TQ98YSe",
              "score": 1.0,
              "passed": true
            },
            {
              "attempt": 3,
              "trial": "performance--004__78bVThR",
              "score": 1.0,
              "passed": true
            }
          ]
        },
        "performance--005": {
          "passed": true,
          "first_pass_attempt": 1,
          "attempts_used": 3,
          "attempts_skipped": 0,
          "attempts_missing": 0,
          "best_score": 1.0,
          "attempts": [
            {
              "attempt": 1,
              "trial": "performance--005__SnEXe9w",
              "score": 1.0,
              "passed": true
            },
            {
              "attempt": 2,
              "trial": "performance--005__d4EZnYr",
              "score": 1.0,
              "passed": true
            },
            {
              "attempt": 3,
              "trial": "performance--005__v2JKrro",
              "score": 1.0,
              "passed": true
            }
          ]
        },
        "performance--006": {
          "passed": true,
          "first_pass_attempt": 1,
          "attempts_used": 3,
          "attempts_skipped": 0,
          "attempts_missing": 0,
          "best_score": 0.9866,
          "attempts": [
            {
              "attempt": 1,
              "trial": "performance--006__xuNj4KT",
              "score": 0.9777,
              "passed": true
            },
            {
              "attempt": 2,
              "trial": "performance--006__fiWDRYz",
              "score": 0.9866,
              "passed": true
            },
            {
              "attempt": 3,
              "trial": "performance--006__DBcLKxE",
              "score": 0.9783,
              "passed": true
            }
          ]
        },
        "performance--007": {
          "passed": false,
          "first_pass_attempt": null,
          "attempts_used": 3,
          "attempts_skipped": 0,
          "attempts_missing": 0,
          "best_score": 0.6667,
          "attempts": [
            {
              "attempt": 1,
              "trial": "performance--007__jbpToB5",
              "score": 0.6667,
              "passed": false
            },
            {
              "attempt": 2,
              "trial": "performance--007__8amRnCN",
              "score": 0.6667,
              "passed": false
            },
            {
              "attempt": 3,
              "trial": "performance--007__vy9Cqfe",
              "score": 0.6667,
              "passed": false
            }
          ]
        },
        "performance--008": {
          "passed": true,
          "first_pass_attempt": 1,
          "attempts_used": 3,
          "attempts_skipped": 0,
          "attempts_missing": 0,
          "best_score": 0.9375,
          "attempts": [
            {
              "attempt": 1,
              "trial": "performance--008__wvYiLRd",
              "score": 0.9375,
              "passed": true
            },
            {
              "attempt": 2,
              "trial": "performance--008__HjQpA6g",
              "score": 0.8972,
              "passed": true
            },
            {
              "attempt": 3,
              "trial": "performance--008__jFG4abh",
              "score": 0.905,
              "passed": true
            }
          ]
        },
        "performance--009": {
          "passed": true,
          "first_pass_attempt": 1,
          "attempts_used": 3,
          "attempts_skipped": 0,
          "attempts_missing": 0,
          "best_score": 1.0,
          "attempts": [
            {
              "attempt": 1,
              "trial": "performance--009__WyBnuRW",
              "score": 1.0,
              "passed": true
            },
            {
              "attempt": 2,
              "trial": "performance--009__yVrtKFm",
              "score": 1.0,
              "passed": true
            },
            {
              "attempt": 3,
              "trial": "performance--009__FFdjWje",
              "score": 1.0,
              "passed": true
            }
          ]
        },
        "performance--010": {
          "passed": true,
          "first_pass_attempt": 1,
          "attempts_used": 3,
          "attempts_skipped": 0,
          "attempts_missing": 0,
          "best_score": 0.9756,
          "attempts": [
            {
              "attempt": 1,
              "trial": "performance--010__SdSFYRk",
              "score": 0.9756,
              "passed": true
            },
            {
              "attempt": 2,
              "trial": "performance--010__6JZN8UL",
              "score": 0.8903,
              "passed": true
            },
            {
              "attempt": 3,
              "trial": "performance--010__CTLyo2V",
              "score": 0.9756,
              "passed": true
            }
          ]
        },
        "performance--011": {
          "passed": true,
          "first_pass_attempt": 1,
          "attempts_used": 3,
          "attempts_skipped": 0,
          "attempts_missing": 0,
          "best_score": 0.9819,
          "attempts": [
            {
              "attempt": 1,
              "trial": "performance--011__ViusbNQ",
              "score": 0.9792,
              "passed": true
            },
            {
              "attempt": 2,
              "trial": "performance--011__fGwjnHE",
              "score": 0.9819,
              "passed": true
            },
            {
              "attempt": 3,
              "trial": "performance--011__gpXE7Tv",
              "score": 0.9741,
              "passed": true
            }
          ]
        },
        "performance--012": {
          "passed": true,
          "first_pass_attempt": 1,